{
  "schemaVersion": 2,
  "definitionVersion": 1,
  "id": "a9b1ea2d-3494-4df2-b045-14882e19c4d2",
  "name": "APMS Student Performance Evaluation",
  "description": "Monitoring guidance based on current standing, attendance, recent results, and advisory prediction signals. This is not an official SIS grade.",
  "factors": [
    {
      "id": "01531263-ec02-4a8b-9ac9-1dc571ab6519",
      "name": "Current standing",
      "source": "current_standing",
      "unit": "percentage",
      "origin": "academic_record",
      "minimum": 0,
      "maximum": 100
    },
    {
      "id": "32ec788c-7bfd-4e3e-b46c-2dbbd8fab97f",
      "name": "Grade component",
      "source": "grading_component",
      "gradingAggregation": "average",
      "unit": "percentage",
      "origin": "academic_record",
      "minimum": 0,
      "maximum": 100
    },
    {
      "id": "91e29a08-5922-4e78-8ba7-5b06d2435ad9",
      "name": "Attendance",
      "source": "attendance_rate",
      "unit": "percentage",
      "origin": "academic_record",
      "minimum": 0,
      "maximum": 100
    },
    {
      "id": "69e99f50-18da-465c-95d7-2cb2c8fa1307",
      "name": "Recent score average",
      "source": "recent_score_average",
      "unit": "percentage",
      "origin": "derived",
      "minimum": 0,
      "maximum": 100,
      "windowSize": 5
    },
    {
      "id": "1f4a693e-ff84-4e9d-97d1-84a765d6e10c",
      "name": "Missing assessments",
      "source": "missing_assessment_count",
      "unit": "count",
      "origin": "derived",
      "minimum": 0
    },
    {
      "id": "fbd5e933-10cc-4e1b-9dc6-70e3a7eeb329",
      "name": "Predicted standing",
      "source": "predicted_standing",
      "unit": "percentage",
      "origin": "ai_prediction",
      "minimum": 0,
      "maximum": 100,
      "aiGenerated": true
    },
    {
      "id": "6d19c71f-333e-44aa-9b20-1a364840a778",
      "name": "AI risk probability",
      "source": "risk_probability",
      "unit": "probability",
      "origin": "ai_prediction",
      "minimum": 0,
      "maximum": 1,
      "aiGenerated": true
    },
    {
      "id": "6110f7d6-3ce6-4ffb-903d-56660217cf18",
      "name": "AI risk level",
      "source": "ai_risk_level",
      "valueType": "category",
      "unit": "category",
      "origin": "ai_prediction",
      "categories": [
        "low",
        "medium",
        "high"
      ],
      "aiGenerated": true
    },
    {
      "id": "18f42072-e8eb-416b-8142-3c92c76d263b",
      "name": "Performance trend",
      "source": "trend",
      "valueType": "category",
      "unit": "category",
      "origin": "ai_prediction",
      "categories": [
        "improving",
        "stable",
        "declining"
      ],
      "aiGenerated": true
    },
    {
      "id": "25d40d71-5a39-49a7-bd4a-eacbdcc9fc48",
      "name": "Prediction available",
      "source": "prediction_available",
      "valueType": "boolean",
      "unit": "boolean",
      "origin": "derived"
    },
    {
      "id": "f3c5f591-6e51-4f17-9e73-1e2ae49f80ac",
      "name": "AI explanation factor count",
      "source": "ai_factor_count",
      "unit": "count",
      "origin": "ai_prediction",
      "minimum": 0,
      "aiGenerated": true
    },
    {
      "id": "821c03e5-3f92-4179-9c21-1d31f42a8395",
      "name": "Prediction age",
      "source": "prediction_age_hours",
      "unit": "count",
      "origin": "derived",
      "minimum": 0
    },
    {
      "id": "3ad79be7-4ce9-4e61-85fa-91a125d3cf9b",
      "name": "AI data basis",
      "source": "data_basis",
      "valueType": "category",
      "unit": "category",
      "origin": "ai_prediction",
      "aiGenerated": true
    }
  ],
  "levels": [
    {
      "id": "e99f5100-6c55-4609-aefb-04f6e9144a28",
      "name": "High Risk",
      "severity": "high",
      "color": "#CA2121",
      "priority": 30,
      "match": "any",
      "rules": [
        {
          "factorId": "01531263-ec02-4a8b-9ac9-1dc571ab6519",
          "operator": "below",
          "threshold": 70
        },
        {
          "factorId": "91e29a08-5922-4e78-8ba7-5b06d2435ad9",
          "operator": "below",
          "threshold": 70
        },
        {
          "factorId": "fbd5e933-10cc-4e1b-9dc6-70e3a7eeb329",
          "operator": "below",
          "threshold": 70
        },
        {
          "factorId": "6d19c71f-333e-44aa-9b20-1a364840a778",
          "operator": "at_least",
          "threshold": 0.7
        },
        {
          "factorId": "6110f7d6-3ce6-4ffb-903d-56660217cf18",
          "operator": "equals",
          "threshold": "high"
        }
      ]
    },
    {
      "id": "b1c00f6e-1d43-40a0-a7d6-8e79e6f7fe9e",
      "name": "Medium Risk",
      "severity": "medium",
      "color": "#CACA21",
      "priority": 20,
      "match": "any",
      "rules": [
        {
          "factorId": "01531263-ec02-4a8b-9ac9-1dc571ab6519",
          "operator": "below",
          "threshold": 80
        },
        {
          "factorId": "91e29a08-5922-4e78-8ba7-5b06d2435ad9",
          "operator": "below",
          "threshold": 80
        },
        {
          "factorId": "fbd5e933-10cc-4e1b-9dc6-70e3a7eeb329",
          "operator": "below",
          "threshold": 80
        },
        {
          "factorId": "6d19c71f-333e-44aa-9b20-1a364840a778",
          "operator": "at_least",
          "threshold": 0.4
        },
        {
          "factorId": "6110f7d6-3ce6-4ffb-903d-56660217cf18",
          "operator": "equals",
          "threshold": "medium"
        },
        {
          "factorId": "18f42072-e8eb-416b-8142-3c92c76d263b",
          "operator": "equals",
          "threshold": "declining"
        }
      ]
    },
    {
      "id": "ea27f1ee-cdce-467f-b0eb-34d4a57b1af5",
      "name": "Low Risk",
      "severity": "low",
      "color": "#21CA21",
      "priority": 10,
      "match": "any",
      "rules": []
    }
  ],
  "classification": {
    "unmatchedSeverity": "low",
    "missingValuePolicy": "ignore_rule",
    "minimumEvidenceCount": 1,
    "requireRecentPrediction": false,
    "colorScheme": "green_to_red"
  },
  "ai": {
    "enabled": true,
    "advisoryOnly": true,
    "institutionallyValidated": false,
    "provider": "Gemini",
    "supportedScenarios": [
      "minimum",
      "maximum",
      "minimum_pass",
      "stable",
      "custom"
    ],
    "inputFeatures": [
      "current_standing",
      "recent_scores",
      "attendance_rate",
      "missing_assessment_count"
    ],
    "outputFields": [
      "predicted_standing",
      "risk_probability",
      "risk_level",
      "trend",
      "factors",
      "model_version",
      "data_basis",
      "generated_at"
    ],
    "riskProbabilityMeaning": "heuristic",
    "unavailablePolicy": "continue_with_available_rules",
    "explanationPolicy": "show_model_factors_as_advisory"
  },
  "decisionPolicy": {
    "advisoryOnly": true,
    "maySetOfficialGrade": false,
    "mayApplyAutomaticPenalty": false,
    "requiresEducatorReview": true,
    "officialRecordSystem": "SWU SIS"
  },
  "explanation": {
    "includeMatchedRules": true,
    "includeInputValues": true,
    "includeMissingInputs": true,
    "includeAiFactors": true
  }
}
